pmid,gene,doi,title,abstract,year,keywords,pubmed_count
28969371,PPARGC1A,10.1093/brain/awx196,Mammalian target of rapamycin complex 1 activation sensitizes human glioma cells to hypoxia-induced cell death.,"Glioblastomas are characterized by fast uncontrolled growth leading to hypoxic areas and necrosis. Signalling from EGFR via mammalian target of rapamycin complex 1 (mTORC1) is a major driver of cell growth and proliferation and one of the most commonly altered signalling pathways in glioblastomas. Therefore, epidermal growth factor receptor and mTORC1 signalling are plausible therapeutic targets and clinical trials with inhibitors are in progress. However, we have previously shown that epidermal growth factor receptor and mTORC1 inhibition triggers metabolic changes leading to adverse effects under the conditions of the tumour microenvironment by protecting from hypoxia-induced cell death. We hypothesized that conversely mTORC1 activation sensitizes glioma cells to hypoxia-induced cell death. As a model for mTORC1 activation we used gene suppression of its physiological inhibitor TSC2 (TSC2sh). TSC2sh glioma cells showed increased sensitivity to hypoxia-induced cell death that was accompanied by an earlier ATP depletion and an increase in reactive oxygen species. There was no difference in extracellular glucose consumption but an altered intracellular metabolic profile with an increase of intermediates of the pentose phosphate pathway. Mechanistically, mTORC1 upregulated the first and rate limiting enzyme of the pentose phosphate pathway, G6PD. Furthermore, an increase in oxygen consumption in TSC2sh cells was detected. This appeared to be due to higher transcription rates of genes involved in mitochondrial respiratory function including PPARGC1A and PPARGC1B (also known as PGC-1&#x3b1; and -&#x3b2;). The finding that mTORC1 activation causes an increase in oxygen consumption and renders malignant glioma cells susceptible to hypoxia and nutrient deprivation could help identify glioblastoma patient cohorts more likely to benefit from hypoxia-inducing therapies such as the VEGFA-targeting antibody bevacizumab in future clinical evaluations.",2017,"glioma; hypoxia; mTOR; oxygen; starvation; Cell Death; Cell Hypoxia; Cell Line, Tumor; DNA Modification Methylases; DNA Repair Enzymes; Glioma; Glucose; Humans; Isocitrate Dehydrogenase; Lactic Acid; Mechanistic Target of Rapamycin Complex 1; Multiprotein Complexes; Mutation; Oxygen Consumption; PTEN Phosphohydrolase; Reactive Oxygen Species; TOR Serine-Threonine Kinases; Tuberous Sclerosis Complex 2 Protein; Tumor Suppressor Protein p53; Tumor Suppressor Proteins",14
27496729,PPARGC1A,10.1016/j.immuni.2016.07.008,Bioenergetic Insufficiencies Due to Metabolic Alterations Regulated by the Inhibitory Receptor PD-1 Are an Early Driver of CD8(+) T Cell Exhaustion.,"Dynamic reprogramming of metabolism is essential for T&#xa0;cell effector function and memory formation. However, the regulation of metabolism in exhausted CD8(+) T (Tex) cells is poorly understood. We found that during the first week of chronic lymphocytic choriomeningitis virus (LCMV) infection, before severe dysfunction develops, virus-specific CD8(+) T&#xa0;cells were already unable to match the bioenergetics of&#xa0;effector T&#xa0;cells generated during acute infection.&#xa0;Suppression of T&#xa0;cell bioenergetics involved restricted glucose uptake and use, despite persisting mechanistic target of rapamycin (mTOR) signaling and upregulation of many anabolic pathways. PD-1 regulated early glycolytic and mitochondrial alterations and repressed transcriptional coactivator PGC-1&#x3b1;. Improving bioenergetics by overexpression of PGC-1&#x3b1; enhanced function in developing Tex cells. Therapeutic reinvigoration by anti-PD-L1 reprogrammed metabolism in a subset of Tex cells. These data highlight a key metabolic control event early in exhaustion and suggest that manipulating&#xa0;glycolytic and mitochondrial metabolism might enhance checkpoint blockade outcomes.",2017,"Animals; Antibodies, Neutralizing; B7-H1 Antigen; CD8-Positive T-Lymphocytes; Cells, Cultured; Cellular Reprogramming; Cellular Senescence; Energy Metabolism; Glucose; Lymphocytic Choriomeningitis; Lymphocytic choriomeningitis virus; Mice; Mice, Inbred C57BL; Mice, Knockout; Peroxisome Proliferator-Activated Receptor Gamma Coactivator 1-alpha; Programmed Cell Death 1 Receptor; Signal Transduction; TOR Serine-Threonine Kinases",14
24995979,PPARGC1A,10.1016/j.cell.2014.04.049,IRF4 is a key thermogenic transcriptional partner of PGC-1&#x3b1;.,"Brown fat can reduce obesity through the dissipation of calories as heat. Control of thermogenic gene expression occurs via the induction of various coactivators, most notably PGC-1&#x3b1;. In contrast, the transcription factor partner(s) of these cofactors are poorly described. Here, we identify interferon regulatory factor 4 (IRF4) as a dominant transcriptional effector of thermogenesis. IRF4 is induced by cold and cAMP in adipocytes and is sufficient to promote increased thermogenic gene expression, energy expenditure, and cold tolerance. Conversely, knockout of IRF4 in UCP1(+) cells causes reduced thermogenic gene expression and energy expenditure, obesity, and cold intolerance. IRF4 also induces the expression of PGC-1&#x3b1; and PRDM16 and interacts with PGC-1&#x3b1;, driving Ucp1 expression. Finally, cold, &#x3b2;-agonists, or forced expression of PGC-1&#x3b1; are unable to cause thermogenic gene expression in the absence of IRF4. These studies establish IRF4 as a transcriptional driver of a program of thermogenic gene expression and energy expenditure.",2014,"Adipocytes; Adipose Tissue, Brown; Adrenergic beta-3 Receptor Agonists; Animals; Cold Temperature; Cyclic AMP; Energy Metabolism; Humans; Interferon Regulatory Factors; Ion Channels; Mice; Mitochondria; Mitochondrial Proteins; Obesity; Peroxisome Proliferator-Activated Receptor Gamma Coactivator 1-alpha; Thermogenesis; Thinness; Transcription Factors; Transcriptional Activation; Uncoupling Protein 1",14
24686533,PPARGC1A,10.1038/ncomms4569,Morphological and functional remodelling of the neuromuscular junction by skeletal muscle PGC-1&#x3b1;.,"The neuromuscular junction (NMJ) exhibits high morphological and functional plasticity. In the mature muscle, the relative levels of physical activity are the major determinants of NMJ function. Classically, motor neuron-mediated activation patterns of skeletal muscle have been thought of as the major drivers of NMJ plasticity and the ensuing fibre-type determination in muscle. Here we use muscle-specific transgenic animals for the peroxisome proliferator-activated receptor &#x3b3; co-activator 1&#x3b1; (PGC-1&#x3b1;) as a genetic model for trained mice to elucidate the contribution of skeletal muscle to activity-induced adaptation of the NMJ. We find that muscle-specific expression of PGC-1&#x3b1; promotes a remodelling of the NMJ, even in the absence of increased physical activity. Importantly, these plastic changes are not restricted to post-synaptic structures, but extended to modulation of presynaptic cell morphology and function. Therefore, our data indicate that skeletal muscle significantly contributes to the adaptation of the NMJ subsequent to physical activity.",2014,"Adaptation, Physiological; Animals; Mice; Mice, Transgenic; Muscle Contraction; Muscle, Skeletal; Neuromuscular Junction; Peroxisome Proliferator-Activated Receptor Gamma Coactivator 1-alpha; Transcription Factors",14
NA,DIO1,NA,NA,NA,NA,NA,0
32835827,DCTD,10.1016/j.pharmthera.2020.107666,TGF&#x3b2;-Directed Therapeutics: 2020.,"The transforming growth factor-beta (TGF&#x3b2;) pathway is essential during embryo development and in maintaining normal homeostasis. During malignancy, the TGF&#x3b2; pathway is co-opted by the tumor to increase fibrotic stroma, to promote epithelial to mesenchymal transition increasing metastasis and producing an immune-suppressed microenvironment which protects the tumor from recognition by the immune system. Compelling preclinical data demonstrate the therapeutic potential of blocking TGF&#x3b2; function in cancer. However, the TGF&#x3b2; pathway cannot be described as a driver of malignant disease. Two small molecule kinase inhibitors which block the serine-threonine kinase activity of TGF&#x3b2;RI on TGF&#x3b2;RII, a pan-TGF&#x3b2; neutralizing antibody, a TGF&#x3b2; trap, a TGF&#x3b2; antisense agent, an antibody which stabilizes the latent complex of TGF&#x3b2; and a fusion protein which neutralizes TGF&#x3b2; and binds PD-L1 are in clinical development. The challenge is how to most effectively incorporate blocking TGF&#x3b2; activity alone and in combination with other therapeutics to improve treatment outcome.",2021,"Bintrafusp alfa; Decorin; Fresolimumab; Glaunisertib; TGF&#x3b2;; Transforming growth factor-beta; Vactosertib; Animals; B7-H1 Antigen; Epithelial-Mesenchymal Transition; Humans; Neoplasms; Receptor, Transforming Growth Factor-beta Type I; Receptor, Transforming Growth Factor-beta Type II; Transforming Growth Factor beta; Tumor Microenvironment",1
33735396,MDN1,10.1007/s00403-021-02213-2,Analysis of mutations in cutaneous squamous cell carcinoma reveals novel genes and mutations associated with patient-specific characteristics and metastasis: a systematic review.,"Cutaneous squamous cell carcinoma (SCC) causes approximately 1,000,000 cases and 9000 deaths each year in the United States. While individual tumor sequencing studies have discovered driver mutations in SCC, there has yet to be a review and subsequent analysis synthesizing current studies. To conduct a comprehensive synthesis and analysis of SCC sequencing studies with individual patient-level data, a comprehensive literature search was performed. Statistical analyses were performed to identify trends. Studies meeting inclusion criteria included a total of 279 patients (189 localized SCCs, 90 metastatic SCCs). Several mutations were correlated with demographic characteristics (TP53, MLL4, BRCA2, COL4A1). TP53, TERT, SPEN, MLL3, and NOTCH2 mutations were significantly more likely to be found in metastatic versus localized SCCs even after the Bonferroni correction for multiple comparisons. Silent mutations were found more in localized SCCs than metastatic SCCs, and nonsense mutations were found more in metastatic SCCs than localized SCCs (p&#x2009;=&#x2009;0.0003 and p&#x2009;=&#x2009;0.04, respectively). Additional mutations were identified that have not yet been explored in SCC including AHNAK2, LRP1B, TRIO, MDN1, COL4A2, SVIL, VPS13C, DST, DMD, and DYSF. Overall, novel mutations were identified and differences between mutation patterns in localized and metastatic SCCs were found. These findings may have clinical applications.",2022,"Cutaneous squamous cell carcinoma; Metastasis; Mutations; Next-generation sequencing; Targeted-therapy; Carcinoma, Squamous Cell; Humans; Mutation; Skin Neoplasms",1
NA,CCDC178,NA,NA,NA,NA,NA,0
36233194,NEIL3,10.3390/ijms231911892,Identification of Candidate Genes in Breast Cancer Induced by Estrogen Plus Progestogens Using Bioinformatic Analysis.,"Menopausal hormone therapy (MHT) was widely used to treat menopause-related symptoms in menopausal women. However, MHT therapies were controversial with the increased risk of breast cancer because of different estrogen and progestogen combinations, and the molecular basis behind this phenomenon is currently not understood. To address this issue, we identified differentially expressed genes (DEGs) between the estrogen plus progestogens treatment (EPT) and estrogen treatment (ET) using the Gene Expression Omnibus (GEO) and The Cancer Genome Atlas (TCGA) data. As a result, a total of 96 upregulated DEGs were first identified. Seven DEGs related to the cell cycle (CCNE2, CDCA5, RAD51, TCF19, KNTC1, MCM10, and NEIL3) were validated by RT-qPCR. Specifically, these seven DEGs were increased in EPT compared to ET (p &lt; 0.05) and had higher expression levels in breast cancer than adjacent normal tissues (p &lt; 0.05). Next, we found that estrogen receptor (ER)-positive breast cancer patients with a higher CNNE2 expression have a shorter overall survival time (p &lt; 0.05), while this effect was not observed in the other six DEGs (p &gt; 0.05). Interestingly, the molecular docking results showed that CCNE2 might bind to 17&#x3b2;-estradiol (&#x2212;6.791 kcal/mol), progesterone (&#x2212;6.847 kcal/mol), and medroxyprogesterone acetate (&#x2212;6.314 kcal/mol) with a relatively strong binding affinity, respectively. Importantly, CNNE2 protein level could be upregulated with EPT and attenuated by estrogen receptor antagonist, acolbifene and had interactions with cancer driver genes (AKT1 and KRAS) and high mutation frequency gene (TP53 and PTEN) in breast cancer patients. In conclusion, the current study showed that CCNE2, CDCA5, RAD51, TCF19, KNTC1, MCM10, and NEIL3 might contribute to EPT-related tumorigenesis in breast cancer, with CCNE2 might be a sensitive risk indicator of breast cancer risk in women using MHT.",2022,"bioinformatic analysis; breast cancer; estrogen plus progestogens treatment; menopausal hormone therapy; Breast Neoplasms; Computational Biology; Estradiol; Estrogen Receptor Antagonists; Estrogen Replacement Therapy; Estrogens; Female; Humans; Medroxyprogesterone Acetate; Menopause; Molecular Docking Simulation; Progesterone; Progestins; Proto-Oncogene Proteins p21(ras); Receptors, Estrogen; Transcription Factors",1
NA,SHCBP1,NA,NA,NA,NA,NA,0
